{
  "case_id": "context-funnel-v1-date-import",
  "discovered_items": [
    ".codex/STATE.yaml",
    "AGENTS.md",
    "fixtures/sample.csv",
    "releases/manifest.json",
    "src/importer.py",
    "src/normalizer.py",
    "src/writer.py",
    "tests/test_importer.py"
  ],
  "unsupported_claims": [],
  "violated_invariants": []
}
